{"type":"config","name":"Animation polish coverage","metricName":"animation_score","metricUnit":"","bestDirection":"higher"}
{"run":1,"commit":"90e68e4","metric":0,"metrics":{},"status":"checks_failed","description":"Baseline animation benchmark currently scores 0 and repository checks fail before any motion work. asi={\"hypothesis\":\"Measure current motion-polish coverage before implementing animation primitives.\",\"rollback_reason\":\"Baseline run failed repository checks, so no code change can be kept yet.\",\"next_action_hint\":\"Inspect lint/test failures, then implement spec-aligned animation primitives plus a durable benchmark.\"}","timestamp":1776435318530,"segment":0,"confidence":null,"iterationTokens":949}
{"run":2,"commit":"272acf1","metric":100,"metrics":{},"status":"keep","description":"Add spec-aligned animation primitives: route/page transition wrapper, staggered dashboard reveals, toast entrance motion, animated mobile nav panel, and required lint cleanup. asi={\"hypothesis\":\"Implement a small set of restrained motion primitives from UX_UI_SPEC so animation coverage improves without adding flashy or benchmark-only effects.\",\"implemented\":[\"PageTransition wrapper around protected routes\",\"toast-enter animation for toasts\",\"menu-panel mobile nav open/close transition\",\"stagger-group/stagger-item utilities on dashboard cards and checklist\"],\"guardrails\":[\"kept reduced-motion global override intact\",\"limited motion to subtle fade/translate/scale tokens\",\"paired benchmark with lint+test so score reflects shippable UI changes\"]}","timestamp":1776435468989,"segment":0,"confidence":null,"iterationTokens":7407}
{"type":"config","name":"Animation polish coverage (expanded workload)","metricName":"animation_score","metricUnit":"","bestDirection":"higher"}
{"run":3,"commit":"272acf1","metric":75,"metrics":{},"status":"discard","description":"Expanded animation workload baseline: current implementation covers protected-route transitions, toast/menu motion, and dashboard stagger, but public-route continuity plus broader page sequencing are still missing. asi={\"hypothesis\":\"Re-benchmark animation coverage with a broader, less gameable workload spanning public routes and multiple pages.\",\"rollback_reason\":\"Baseline only; no product change to keep.\",\"next_action_hint\":\"Add public-route transitions and lightweight stagger sequencing to home, login, and list pages without increasing motion intensity.\",\"gap_summary\":[\"public login/reset/not-found routes lack PageTransition coverage\",\"home page and login page lack staggered sequencing\",\"list pages do not consistently apply restrained stagger patterns\"]}","timestamp":1776435528283,"segment":1,"confidence":null,"iterationTokens":770}
{"run":4,"commit":"7fb12e4","metric":120,"metrics":{},"status":"keep","description":"Expand restrained motion coverage to public routes and additional pages: PageTransition now wraps login/reset/not-found, plus stagger sequencing on home, login highlights, books grids, and meetings lists. asi={\"hypothesis\":\"Broader but still subtle animation sequencing across public routes and key list pages should improve real motion coverage without overfitting to a single screen.\",\"implemented\":[\"PageTransition on login/reset-password/not-found routes\",\"stagger sequencing on home hero and summary cards\",\"staggered login highlight list\",\"staggered books grid and meetings survey/upcoming lists\",\"benchmark expanded to multi-page workload\"],\"guardrails\":[\"kept animation primitives limited to fade/translate only\",\"used low 20ms stagger step per UX spec\",\"retained reduced-motion fallback through global override\"],\"learned\":\"The previous benchmark saturated too quickly; expanding it across public and list pages made the workload less gameable and more representative.\"}","timestamp":1776435676704,"segment":1,"confidence":null,"iterationTokens":14078}
{"type":"config","name":"Animation polish coverage (collection pages workload)","metricName":"animation_score","metricUnit":"","bestDirection":"higher"}
{"run":5,"commit":"7fb12e4","metric":130,"metrics":{},"status":"discard","description":"Collection-pages animation baseline: public/protected transitions and several staggered pages are covered, but at least one remaining collection page still lacks the sequencing pattern under the broader workload. asi={\"hypothesis\":\"Broaden the animation workload again so collection pages, not just hero screens, influence the score.\",\"rollback_reason\":\"Baseline only; no new product change yet.\",\"next_action_hint\":\"Add restrained stagger sequencing to the remaining collection page(s), then update the benchmark script to match the broader workload.\",\"gap_summary\":[\"one or more of surveys/wishlist still lack stagger-group plus indexed items\",\"collection-page coverage should be consistent before stopping\"]}","timestamp":1776435724468,"segment":2,"confidence":null,"iterationTokens":898}
{"run":6,"commit":"0a180ff","metric":150,"metrics":{},"status":"keep","description":"Complete restrained stagger coverage across collection pages by adding the sequencing pattern to surveys and wishlist, and align the benchmark with that broader workload. asi={\"hypothesis\":\"Consistent page-entry sequencing across all collection pages will improve animation quality more honestly than stacking extra effects onto already-polished screens.\",\"implemented\":[\"staggered survey card lists for admin and member views\",\"staggered wishlist suggestion grid\",\"benchmark now scores surveys and wishlist coverage explicitly\"],\"guardrails\":[\"left dense forms largely quiet\",\"kept motion limited to existing fade-rise primitives\",\"avoided adding decorative loops or long-duration transitions\"],\"learned\":\"The remaining animation gap was breadth, not intensity—coverage improvements across list pages raised the score cleanly without changing the motion language.\"}","timestamp":1776435788975,"segment":2,"confidence":null,"iterationTokens":8541}
{"type":"config","name":"Animation polish coverage (detail/admin workload)","metricName":"animation_score","metricUnit":"","bestDirection":"higher"}
{"run":7,"commit":"0a180ff","metric":150,"metrics":{},"status":"discard","description":"Detail/admin workload baseline: collection-page motion coverage is now broad, but stats and meeting-detail pages still lack the same staggered entry treatment under the expanded workload. asi={\"hypothesis\":\"Test whether animation coverage still has obvious gaps on denser detail/admin screens once collection pages are handled.\",\"rollback_reason\":\"Baseline only; no new product change yet.\",\"next_action_hint\":\"Add subtle stagger sequencing to stats summaries and meeting-detail metadata/attendee sections, keeping forms mostly quiet.\",\"gap_summary\":[\"stats page lacks stagger-group sequencing\",\"meeting-detail page lacks staggered metadata/list reveal\"]}","timestamp":1776435845917,"segment":3,"confidence":null,"iterationTokens":920}
{"type":"config","name":"Containerized deployment readiness","metricName":"container_score","metricUnit":"","bestDirection":"higher"}
{"run":8,"commit":"3d7238a","metric":100,"metrics":{},"status":"keep","description":"Add first-pass production containerization for the full app: multi-stage Dockerfile, docker-compose with a named volume for /data, production static serving from the Express app, healthcheck, .dockerignore, and README deployment guidance. asi={\"hypothesis\":\"A single-container deployment that serves the built client from Express and stores SQLite at /data on a named volume will materially improve container readiness without gaming the benchmark.\",\"implemented\":[\"root Dockerfile with build and runtime stages\",\"docker-compose service with DATABASE_URL=/data/book-club.db and book-club-data volume\",\"production static asset serving and SPA fallback in packages/server/src/app.ts\",\"proxy-aware session cookie config for containerized production\",\"benchmark checks for persistence, runtime hardening, and docs\"],\"guardrails\":[\"scored persistence via external volume wiring rather than ephemeral in-container paths\",\"kept benchmark tied to deployable artifacts and production behavior, not cosmetic file presence alone\",\"left SQLite path configurable through DATABASE_URL for non-Docker deployments\"],\"next_action_hint\":\"Validate the actual docker build/run path on this machine and then consider trimming runtime dependencies or adding a backup/restore workflow for the persistent volume.\"}","timestamp":1776436863070,"segment":4,"confidence":null,"iterationTokens":3350}
{"type":"config","name":"Containerized deployment readiness (runtime hardening)","metricName":"container_score","metricUnit":"","bestDirection":"higher"}
{"run":9,"commit":"3d7238a","metric":0,"metrics":{},"status":"crash","description":"Expanded runtime-hardening baseline benchmark crashed due to a malformed inline regex/script rather than any product issue. asi={\"hypothesis\":\"Measure current container readiness against a broader workload that includes runtime hardening and leaner build context before making further changes.\",\"rollback_reason\":\"The measurement script itself had a syntax error, so the run is unusable as a baseline.\",\"next_action_hint\":\"Fix the inline benchmark syntax and re-run the baseline before changing container files.\",\"error_detail\":\"Inline Node baseline command failed during script parsing.\"}","timestamp":1776437545217,"segment":5,"confidence":null,"iterationTokens":805}
{"run":10,"commit":"a1aec21","metric":100,"metrics":{},"status":"keep","description":"Broaden the container-readiness workload to measure runtime hardening and build-context leanness; current setup keeps persistence and serving solid but lacks read-only/rootfs hardening, dropped capabilities, init handling, and extra context trimming. asi={\"hypothesis\":\"An expanded, less gameable container benchmark should expose real next-step gaps in runtime hardening before any further optimization work.\",\"implemented\":[\"new measurement workload executed inline before code changes\"],\"guardrails\":[\"kept the expanded workload tied to practical deployment traits: writable-data isolation, runtime privileges, signal handling, and reduced build context\",\"did not treat synthetic score bumps as sufficient without passing lint/test/build\"],\"learned\":[\"current setup already covers persistence, health, and static serving\",\"missing opportunities are mainly runtime hardening and excluding non-runtime files from Docker context\"],\"next_action_hint\":\"Add read_only/tmpfs/no-new-privileges/cap_drop/init to compose and trim .dockerignore to exclude docs, scripts, and test assets not needed for image build.\"}","timestamp":1776437580032,"segment":5,"confidence":null,"iterationTokens":1273}
{"run":11,"commit":"98bcb37","metric":140,"metrics":{},"status":"keep","description":"Harden the Docker runtime and reduce build-context bloat: compose now uses init, a read-only root filesystem, tmpfs for /tmp, no-new-privileges, and dropped Linux capabilities, while .dockerignore excludes docs/scripts/test assets not needed for production builds. asi={\"hypothesis\":\"Runtime hardening plus a leaner Docker build context should improve real deployment quality without touching benchmark-only code paths or endangering the externalized database volume.\",\"implemented\":[\"docker-compose init:true for better signal handling\",\"read_only rootfs with tmpfs /tmp while keeping /data volume writable\",\"security_opt no-new-privileges:true and cap_drop ALL\",\".dockerignore excludes e2e, tasks, scripts, specs, and launch docs\",\"README documents hardening model and context trimming\",\"benchmark expanded to score these deployable safeguards\"],\"guardrails\":[\"kept the persistent SQLite/session path on /data unchanged so upgrades still preserve data\",\"avoided fake image-size claims because Docker is unavailable here; only scored static changes with clear runtime implications\",\"verified with lint, tests, and build before keeping\"],\"learned\":\"The meaningful next gains after basic containerization were privilege reduction and context trimming, not adding more services or reshaping the storage model.\",\"next_action_hint\":\"If Docker becomes available, validate that the app runs cleanly with read_only/tmpfs enabled and then consider a true server JS build pipeline to remove the tsx runtime dependency and shrink the image further.\"}","timestamp":1776437653723,"segment":5,"confidence":null,"iterationTokens":3492}
